,full_text,tweet_english
1103,gw udah scroll lama sampe bawah 100 gw baca ada dukung kasih nilai positif sama danantara rata rata todos percaya karana track record lama yang bisa cari sendiri berita belakang juga isi korupsi semua,i've scrolled for a long time until under 100 I read there is support for the same positive value and between the average todos believe because of the old track record that can find its own news and the content of corruption all
1104,danantara susul klasemen liga korupsi indonesia,and between the following Indonesian corruption league standings
1105,makanya suatu hari akan heran kalau kasus korupsi danantara yaaa udah siap tinggal bilang kaaannnn wkwkwkwkw,so one day you will be surprised if the case of corruption and between yaaa is ready to stay say kaaannnn wkwkwkw
1106,bagai rakyat tau danantara baik spt hal temasek hazanah tp trust hancur hantam mega korupsi tubi tubi bagaimana kembali percaya rakyat pihak asing tidak percaya investasi sini bagaimana beri pasti rakyat,like the people know and between good things like the theme of hazanah tp trust destroyed hit mega corruption tubi tubi how to re-believe the people of foreign parties do not believe investment here how to give sure the people
1107,yakin percaya pak kalau danantara akan ada posisi pertama klasemen liga korupsi indonesia,sure believe sir that and between there will be first place in the Indonesian corruption league standings
1108,antara kelola danantara salah satu isi mantan napi korupsi bank bi final oocrp bagaimana masyarkat para pakar ekonom masih rawat akal waras percaya optimis yuk tetap ikut jaga pikir waras pak,between manage and between one of the contents of the ex-convicts of bank corruption bi final oocrp how the community of economists still take care of sane minds believe optimistic let's keep keeping sane mind sir
1109,wakil warga negara rakyat republik indonesia nyata 100 kami khawatir pak kami tahu yakin betul danantara pada suatu hari jadi buah skandal korupsi besar sampai baik pernah cipta republik,representative of the citizens of the people of the republic of Indonesia real 100 we are worried sir we know very sure and between one day the fruit of a big corruption scandal until either ever created a republic
1110,luar biasa mega korupsi negri atas akal waras manusiasapu kotor buat bebersihdi lembagakandanantara lembaga siap bangkrutbakal curi rame2terutama pol tikus tidak punya jiwa negarawan,"extraordinary mega-corruption of the country over the common sense of humans, dirty sweep for cleaning in institutions and between institutions ready to go bankrupt, stolen rame 2, especially pol mice do not have the soul of a statesman"
1111,sing penting ora korupsi jujur buka rakyat danantara dana milik seluruh rakyat indonesia bukan milik perintah,important ora honest corruption open the people and between funds belonging to all the people of Indonesia not belonging to the order
1112,danantara salome satu lobang rame rame lobang korupsi,and between salome one hole rame rame hole corruption
1113,program bagus tp tingkat percaya rakyat thdp perintah sangat buruk trauma banyak korupsi mungkin danantara muncul saat tidak tepat,good program but the level of trust in the people of thdp orders is very bad trauma a lot of corruption is possible and between appears when it is not appropriate
1114,sok sok an tantang gitu padahal bukti korupsi aja udah dimanamana segala mau ngebuktiin danantara selamat ekonomi pret ah,sok sok an tantang like that even though the evidence of corruption is where everyone wants to prove it and between economic congratulations pret ah
1115,lama aja korupsi pak yang baru kayak danantara kamu cari benar maupun bela masyarakat kami terlakamu sering kecewa para jabat di negeri yang mayoritas nya koruptor,"for a long time, the corruption, sir, is new and between you looking for the right and defending our community, you often disappoint the officials in a country where the majority are corrupt"
1116,cair bos tinggal nggu info korupsi danatalang eh danantara,liquid boss stay with corruption info and brook eh danantara
1117,awas orang pak bgmana rakyat sangsi justru orang biang korupsi nkri rakyat sangat hakkul yakin danantara akan boncos,"beware of the people, sir, how the people are suspicious, precisely the people who are the culprits of corruption, the people are very right to be sure and between boncos"
1118,memang kalau bicara gampang kalau berani jabat tanggung jawab berani hukum gantung penjara umur hidup kalau jadi korupsi danantara apa berani kalau yakin hasil berani jamin,"indeed, if it is easy to speak if you dare to hold responsibility, dare to punish hanging in prison for life if it becomes corruption and between what do you dare if you are sure that the results dare to guarantee"
1119,hajat hidup orang banyak asai koruptor oligarki presiden ini dilema mau juang rakyat sungguh omon omon danantara bisa jadi ladang mega korupsi baru,the life expectancy of many people asai corrupt oligarchy president this dilemma want to fight for the people really omon omon and between could be a new mega field of corruption
1120,diri startup investasi raymond chin tanya ceo danantara ros roeslani skala 0100 berapa yakin jadi korupsi danantara program ros ros berani jamin 100 persen diri tim akan laku korupsi juga akan,self investment startup raymond chin ask ceo and ros roeslani scale 0100 how sure to be corruption and between the ros ros program dare to guarantee 100 percent of the team will also sell corruption
1121,asabri jiwasraya pertamina jadi ladang korupsi sekarang bentuk danantara jadi ladang korupsi makin besar liat aja pejabat2nya isi lingkar kuasa semua,asabri jiwasraya pertamina so the corruption field is now in the form and between so the corruption field is getting bigger see the officials fill in the circle of power of all
1122,bagaimana khawatir muncul trust issue sedangakan jabat danantara yang mantan napi korupsi yang keponakan jabat negara undang2 di buat sedemikianrupa kpk bapak jaksa ingin laku periksa seijin dpr sangat bisa percaya,how worried about the emergence of trust issue is that the ex-corruption inmates who are nephews of the state official are made in such a way that the prosecutor wants to practice checking the permission of the DPR are very trustworthy
1123,tekan potensi korupsi danantara amat minta perintah ketat tata kelola,press the potential for corruption and between strongly asking for strict governance orders
1124,dukung kalian publish liga korupsi indonesia kami mau bukti kerja pak nanti tinggal tunggu korupsi makan siang gratis jamaah danantara,support you publish the Indonesian corruption league we want proof of work sir later just wait for corruption free lunch for pilgrims and between
1125,untung udah buka mereka nih tau danantara sih bahas korupsi pertamina muka noh bahas danantara bakal jadi ladang korupsi super duper mega besar,"fortunately, it has opened them up, you know, and between discussing the corruption of Pertamina, the face of the discussion and between will become a super duper mega big corruption field"
