,full_text,tweet_english
1022,korupsi orang2 nya jokowi tuh udah banyak jamur then tiba2 was wes wos muncul danantara gk diskusi sama rakyat tiba2 udah luncur aja tuh negara apa sih lama2 jadi orde baru part 2 dah gue udah titik tinggi buat gk percaya sama perintah bye,the corruption of the people of jokowi was a lot of mushrooms then suddenly was wes wos appeared and between gk discussions with the people suddenly slid away just what country it was so long ago so the new order part 2 was already a high point for me to believe the same order bye
1023,gak sabar tunggu berita korupsi danantara,can't wait for news of corruption and
1024,ingat kelas dana haji aja di malinginkorupsi nanti danantara kata bisa audit bapak n kpk,just remember the class of Hajj funds in Malinginkorupsi later and between the words you can audit Mr. n kpk
1025,danantara pesimistis massal kadung trust issue berita kasus2 korupsi utama perusahaan2 bumn bukan mereka nyata rugi akibat mismanagement alibi mnjdi momok masyarakat hilang percaya manuver investasi apa,and mass pessimistic intermediaries kadung trust issue news of major corruption cases of bumn companies instead they are real losses due to mismanagement alibi mnjdi scourge people lost believe what investment maneuvers
1026,izin pak bapak tahu yang nama korupsi baik jam bapak jaman jokowi jaman prabowo 100 sya yakin ada korupsi simpel hanya butuh pasti nanti ada korupsi danantara siap hukum mati saja,"permission, sir, you know that the name of corruption is good at the time, Mr. Jokowi Jaman Prabowo 100 I believe that there is simple corruption, just need to be sure that there will be corruption and between is ready to be executed"
1027,pak semua erti tuju benar baik lihat dari sisi bentuk hngga jajar tunggang danantara sarat penting politik elit tentu sebut mereka yang ingin saling tahan kuasa ujung korupsi,"sir, all the meaning is true, both in terms of the shape of the riding line and the important intermediary, elite politics, of course, say those who want to withstand each other's power, the end of corruption"
1028,korupsi 1000t akan evaluasi koplak begini suruh percaya danantara bank emas,corruption 1000t will evaluate KOPLAK like this tell trust and between gold banks
1029,bapak jamin danantara tidak awas tanpa transparansi bakal bebas korupsi gausah jauh2 pak lama 10 tahun akhir aja berapa banyak jabat korupsi tahu yang belum tahu yakin lebih banyak pak,"mr. Bail and Antara are not careful without transparency, they will be free of corruption. Gausah, far from the last 10 years, how many corrupt officials know who do not know, they are sure that more sir"
1030,bukan khawatir sih mah udah 1000 yakin danantara bakal jadi ladang korupsi,i'm not worried that 1000 are sure and between them it will become a field of corruption
1031,in conclusion danantara luncur bukan penting rakyat maupun maju negara lain cara baru pejabrut korupsi bisa adil hukum,"in conclusion and between sliding is not important for the people or for other countries, the new way of corruption can be fair and legal"
1032,lama danantara kelola transparan publik harap ada balik kelola tutup akuntabilitas publik transparan potensi korupsi sangat besar danantara kunci nya prudent transparan ada manfaat rakyat,"for a long time and between transparent public management, it is hoped that there will be a reverse management of transparent public accountability, the potential for corruption is very large and among the keys to being prudent, transparent, there are people's benefits"
1033,lihat realita ada semua bidang habis korupsi saya sangat khawatir danantara akan jd lembaga korupsi brutal ingat pepatah jangan leta telur satu wadah tidak mau habis semua potensi kaya bangsa,see the reality there are all areas of corruption I am very worried and between the brutal corruption institutions remember the saying do not leta eggs one container does not want to exhaust all the rich potential of the nation
1034,pertama sangat tuju ada nya danantara nusantara saya pribadi program sangat bantu uang indonesia pantau baik para investor ngga takut nama nya uang di korupsi karena investor takut uang di korupsi,the first is very purposeful there is and between the archipelago I personally program is very helpful for Indonesian money monitor well the investors are not afraid of the name of the money in corruption because investors are afraid of money in corruption
1035,sy yakin tuju goal ingin capai proyek danantara baik buka investasi erak ekonomi indonesia lbh masif tapi pak mohon maaf sdh sgt pesimis para kelola negara 14k t jadi lahan baru untuk bancak korupsi,"i am sure the goal is to achieve the project and between it is good to open massive LBH Indonesian economic investment but sir, I apologize for being pessimistic about managing the country 14k t being a new land for corruption"
1036,ikn selesai alih isu2 kini danantara rakyat butuh semua pak notabene sela n cela buat brengsek kuasa korupsi,ikn finished over the issues now and between the people need all sir incidentally interrupt n reproach for the asshole of corruption power
1037,dana segar buat bancak rame rame pak salam adalah presiden baik sejak era reformasi beri masuk prabowo sijat habis korupsi itu danantara bisa percaya,fresh funds for bancak rame rame pak salam is a good president since the reform era gave entry to prabowo sijat after the corruption and between can believe
1038,kalo ekonomi tambah buruk nilai index saham turun mending stop danantara pak bilang pak presiden ingat rakyat khawatir sekali mirip 1mbdb malaysia lagi orang ngelola orang titip semua ada pernah penjara kasus korupsi,"if the economy is worse, the value of the stock index is down, mending stop and between, sir, said the president remembers that the people are worried that it is like 1mbdb in malaysia again, people manage people, all of whom have been jailed for corruption cases"
1039,danantara bukan jadi tempat parkir uang hasil korupsi jahat yang lama ada ln pak yakin itu,"and between them is not a parking lot of money from the evil corruption that has existed for a long time, I'm sure"
1040,mohon maaf pak danantara muncul saat kasus kasus korupsi negeri makin manusiawi wajar banyak pihak pesimis,"i'm sorry, Mr. Danantara, when the case of corruption in the country is getting more humane, many parties are pessimistic"
1041,buka terus buka habis tahun2 ikut bakal omong jaman jabat banyak jabat tangkap kasus korupsi hmm iya sih situ speechnya jelek terus danantara tempat money laundry kan eh whoops usaha legal deh bener,"open continue to open after 2 years of going to talk about the era of the shaking many shakes catch corruption cases hmm yes, that's where the speech is bad and between places where money laundry is eh whoops legal business right"
1042,masih jokowi luhut kroni2nya ngurusin percaya 100 kalo danantara bakal hasil jadi ajang korupsi rame2,still jokowi luhut kroni2nya manage to believe 100 if and between the results will be the scene of corruption rame2
1043,bahkan jika malaikat suruh kelola danantara sy tetap ragu pak bagaimana prestasi selenggara negara dlm seleweng korupsi di luar nalar entah mahluk jenis apa saat kendali negara pak,"even if the angels tell me to manage and between, I still have doubts, sir, how the performance of state officials in corruption deviates from reason, whether what kind of creature when the control of the state, sir"
1044,blueprint tatakelola danantara sekarang saya yakin kok bang yakin bakal jadi proyek bancak korupsi maksud,blueprint of governance and between now I'm sure why I'm sure it will be a project of corruption
1045,betu pikir danantara bakal jd wadah korupsi baru,betu think and between will be a new corruption container
1046,yakin danantara jadi ladang korupsi tanda tweet ini,sure and between being a field of corruption this tweet sign
1047,fix kok pak mindset kami2 rakyat danantara vehicle korupsi dr banyak l3mbaga perintah dana besar dikprupsi tidak yang asabri jiwasraya lain plus urus mabtan sangka korupsi yang buat rakyat percaya,fix why is it that our mindset is the people and between vehicles of corruption from many l3mbaga orders for large funds to be corrupted not the other asabri soulwasraya plus manage mabtan thought that corruption made the people believe
1048,klo korupsi moga kelola danantara korupsi masuk neraka abadi,clo corruption let's manage and between corruption and eternal hell
1049,tidak cemas pak saya realistis lihat banyak jabat kasus korupsi akhir2 saya yakin danantara upaya korupsi besar2an sengsara rakyat,not anxious sir I am realistic to see many shakes of corruption cases lately I am sure and between major corruption efforts the people are miserable
1050,diri startup investasi raymond chin tanya ceo danantara ros roeslani skala 0100 berapa yakin jadi korupsi danantara program ros ros berani jamin 100 persen diri tim akan laku korupsi juga akan,self investment startup raymond chin ask ceo and ros roeslani scale 0100 how sure to be corruption and between the ros ros program dare to guarantee 100 percent of the team will also sell corruption
1051,after all those kasus korupsi berulangulang jangan heran kalau rakyat percaya sama kola danantara pak apa jajar atas itu people have zero expectations over gibran jokowi ex napi koruptor bi luhut,"after all those corruption cases are repeated, don't be surprised if the people believe in kola and between what are the alignments above, people have zero expectations over gibran jokowi ex prisoner of corruption bi luhut"
1052,rasional aja lah pak ada baik bukan malah bikin program baru masih uji coba jor2an mau bikin danantara tp banyak orang2 di phk pabrik banyak tutup korupsi sampe triliun uang kalo buat rakyat bantu banget aneh banget lah,"rational, sir, there is good, not even making new programs, still testing jor2an, want to make and between but many people in phk factories, many close corruption to trillions of money, if for the people, it's really strange"
1053,memang benar tuju baik sekarang masyarakat skeptis kelola danantara pak lebih kasus korupsi rugi miliar hingga triliun hampir sering dengar,"it is true that the direction is good now people are skeptical about managing and between packs of more corruption cases, losses of billions to trillions are almost often heard"
1054,jamin 100 jamin apa kalo jadi korupsi danantara mohon maaf plus materai 10 rebu,guarantee 100 guarantee what if it becomes corruption and between apologies plus stamp duty 10 rebu
1055,sedang tunggu kasus korupsi danantara,waiting for cases of corruption and between
1056,niat baik sih tapi gimana danantara jadi lumbung korupsi,good intentions but how and between being a barn of corruption
1057,kalo amat ini tulis khawatir sby arti juga tau kalo benar danantara ladang korupsi kalimat akhir sangat jelas situasi,if it's really this write worry sby arti also know if it's true and between corruption fields the final sentence is very clear the situation
1058,danantara modal ambil banyak anggar esensial public serbice paksa potong alas efisiensi padahal danantara lihat tabel korupsi sudah nyentuh kuadriliun yang korup bahkan barang non subsidi kurang sangsi gana rakyat,and between capital take a lot of essential fencing public serbice forced to cut the efficiency pedestal even though and between see the corruption table has touched the corrupt quadrillion even non-subsidized goods less doubt about the people
1059,lelah percaya pak semua sektor penuh korupsi sekarang malah danantara rakyat mau bodoh,tired of believing that all sectors are full of corruption now and the people want to be stupid
1060,tanggap bapak program danantara tanggap dong mega korupsi ada jelas2 rugi negara masyrakat buat apa luncur program yang belum untung kalau mega korupsi nya mana,the responsiveness of the program and between the responsiveness of dong mega corruption there is clearly a loss of the community for what is the launch of the program that has not been profitable if the mega corruption is where
1061,danantara lebih besar pertamina bumn yang pernah korupsi jadi nanti jadi korupsi besar sejarah kkn harga mati jaya kkn,"and between the larger Pertamina bumn that was once corrupt, so it will be a big corruption of history, especially the price of death, right?"
1062,danantara audit dana kelola tdklah sedikit jangan danantara jadi tempat meningkankan korupsi jabat beramai2 tempat bancak para jabat nikmat danantara pasti hukum jelas,and between the audit of the management fund is not a little bit and between it is a place to increase the corruption of the jabat in droves the place of the bancak the jabat favors and between the sure the law is clear
1063,khawatir danantara hanya jadi ladang korupsi baru kalau mau ekonomi maju hancur korupsi jangkit bumn,worry and between is only a new field of corruption if you want the developed economy to be destroyed by corruption in the fall
1064,benang kusut korupsi pertamina danantara aman lewat,tangled threads of Pertamina corruption and secure between passing
1065,sejarah 2 out of 2 failed jiwasraya asabri why the 3rd satu will be a success malah 2 minggu ada berita korupsi gila2an angan2 kosong kalau ngarep danantara akhir baik mungkin butuh 5 tahun tp optimis gagal,history 2 out of 2 failed soul asabri why the 3rd one will be a success even 2 weeks there is news of corruption crazy wishful thinking empty if ngarep and between good endings it may take 5 years but optimistically fail
1066,korupsi rajalela tangan koruptor kes enggan kurang transparan buat skeptis diri danantara,"corruption of Rajalela, the corrupt hand of the case, is reluctant to lack transparency for self and intermediary skeptics"
1067,aowkaowkaokwoa bagi rakyat dari awal udah yakin danantara jadi lahan baru korupsi,aowkaowkaokwoa for the people from the beginning have been convinced and between being a new land of corruption
1068,benang kusut korupsi pertamina danantara aman saat tangantangan lihat gerak orkestrasi rentet kasus ungkap belakang apa hubung kasus korupsi pertamina danantara hingga pagar laut belum usai,the tangled threads of Pertamina corruption and between is safe when tangantang see the motions of the orchestration rentet case reveal what is the connection between the Pertamina corruption case and between until the sea fence has not been completed
1069,mohon maaf pak korupsi aja makin banyak pak danantara ntaran duka deh rugi negara makin banyak yee lapangann kerja makin sedikit pajak sembako bahan pokok lain makin tingkat harga pak,"sorry, sir, there is more corruption, sir, and between the reasons for the loss of the country, the more jobs there are, the less taxes on other basic goods, the more the price level, sir."
1070,benar danantara di kertas mungkin lihat bagus track record perintah indonesia buat danantara jadi janji bagaimana bisa percaya perintah semua kasus korupsi jadi hukum koruptor tidak jelas,true and between on paper maybe look at the good track record of Indonesian orders made and between so the promise of how to trust the orders of all corruption cases so that the laws of corruption are unclear
1071,rakyat jelata harap seperti bapak sampai tetapi pilih sosok bertanggungjawab danantara sudah cukup buat curiga coba bagaimana bapak sosok bukti punya track record korupsi percaya,the common people hope to be like you to but choose a responsible figure and between it is enough to be suspicious try how do you figure the evidence of having a track record of corruption believe
1072,kok prasaan tiba2 banget opini jelek soal kaum minoritas ama b20 alias hiv tengah ribut perkara danantara sama korupsi pertamax kyknya udah fokus puasa ama maki2 pmrnta aja,why is prasaan suddenly such a bad opinion about the Ama B20 minority aka hiv is in the middle of a fuss over the matter and between the same corruption firstx kyknya already focused on fasting ama maki2 pmrnta aja
1073,duga korupsi pertamina bagaimana percaya publik danantara minta klarifikasi ceo danantara ros roeslani lengkap saksi sini,suspicion of corruption pertamina how to trust the public and between asking for clarification ceo and ros roeslani complete witness here
1074,hei bo lama hukum negeri tidak tega benar praktik suap korupsi hukum sangat berat bahkan hukum mati jabat korupsi kalo hukum di tegak benar usah danantara indonesia maju,"hey bo long time public law does not have the heart to be true, the practice of bribery, legal corruption is very heavy, even the death penalty is corrupt if the law is upheld properly, and Indonesia is progressing"
1075,taspen asabri sptinya fraud nya pake dalih krugian investasi harap p yakinkn qt duka jk pmerintah tlh bnr2 mnata sistem etika brnegara srius brtindak brantas korupsi tnpa pndang partai shg masyarakat investor mgkn akn yakin tuju besar danantara,taspen asabri such as fraud use the pretext of investment losses please p yakinkn qt duka jk pmerintah tlh bnr2 mnata ethical system brnegara srius brtindak brantas graft tnpa pndang party shg public investor mgkn akn yakinuju besar danantara
1076,teh khawatir yakin betul danantara jd bahan korupsi gedegedean,teh worry sure and between jd gedegedean corruption material
1077,ga yang cemas pak soal semua orang udah tau danantara buat korupsi orang orang kaya biar makin kaya,"don't you worry, sir, about everyone already knowing and between corruption of the rich so that they get richer"
1078,hah pertamina bumn bukan boss 1 bumn ajah potensi korupsi nya 1 kuadriliun terus rakyat suruh percaya gitu danantara ngelola dana lebih besar pertamina lucu kali jabat negara,hah pertamina bumn not boss 1 bumn ajah potential corruption 1 quadrillion then the people told me to believe that and between managing bigger funds pertamina funny times the state shake
1079,kelompok olah olah duli takut korupsi danantara benar kelompok khianat benar ingin lihat negara bangsa indonesia berdaulatberdikari ekonomi bawah pimpin presiden prabowo subianto saja inti nya pak,"the duli group is afraid of corruption and between it is true that the treasonous group really wants to see the sovereign Indonesian nation state from the economy under the leadership of president Prabowo Subianto, the core of it, sir"
1080,pun tuju mas cemas nggak heran bentuk wadah korupsi baru lebih percaya messi orang cianjur percaya danantara sesuai tuju,also headed mas anxiously no wonder the new corruption container forms more trust messi people cianjur trust and between as intended
1081,muak pak kasih tonton uang negara korupsi muak bagai proyek dng anggar besar gaada hasil danantara libat uang besar dalam pak rawan disalahgunakan tidak benar2 tangan orang mumpuni ada jokowi dalam,fed up sir love watch money state corruption fed up like a project with large fencing gaada results and between the involvement of large money in the pack prone to misuse not really the hands of qualified people there are jokowi in
1082,saya heran apa ada orang bersih kelola danantara malah isi final occrp bekas orang pernah terlobat kasus korupsi bapak faham soal,"i wonder if there are clean people managing and between the contents of the final occrp, former people have been treated for corruption cases, you understand about"
1083,allah pak bapak tu presiden indonesia paling oke paling gahar zaman berantas korupsi pandang buka usah main ama pak sumpah nyoreng marwah bapak bapak ngomong soal danantara udah jelas questionable pak udah pak,allah Pak Pak Pak Pak Pak Pak Pak Pak Pak Pak Pak Pak Pak Pak Pak Pak Pak Pak Pak Pak Pak Pak Pak Pak Pak Pak Pak Pak Pak Beruh Danantara Already Clearly Questionable Pak Pak
1084,tidak ada audit bebas jerat hukum kelola kami makin yakin danantara korupsi sama bank emas money laundry,there is no free audit of the legal noose of governance we are increasingly convinced and between corruption and gold bank money laundry
1085,korupsi anggar asset maupun sumber daya lain laku cara manipulasi lapor guna bagaimna sistem awas periksa bangun danantara tutup ruang manajemen danantara laku korupsi,"corruption of fencing assets and other resources practice how to manipulate reports in order to ensure that the system is vigilant, check the construction and between closing the management room and between corruption behavior"
1086,pak bagaimana masyarakat boleh ragu danantara terus tonton kan halhal seperti padahal kami harap beritaberita aksitindakan nyata serius perintah basmi korupsi pandang partai,"sir, how can the public doubt and between continue to watch things like when we hope that the news of real action is serious about the order to eradicate corruption from the view of the party"
1087,eep syaifulah sh amat politik danantara bawah ancam politisasi korupsi kuasa rangkap jadi usaha dana danantara manfaat mika 2029 mulai presiden gelincir guna dana investasi seperti mika 2024 jokowi,eep syaifulah sh is very political and between under the threat of politicization of dual power corruption into a fund business and between the benefits of mica 2029 starting the president to slip to investment funds such as mika 2024 jokowi
1088,cemas nyata danantara bakal jadi ladang baru buat korupsi,real anxiety and between will become a new field for corruption
1089,yakin danantara untuk bagi2 kue jabat kalau para koruptor hukum se berat2nya hukum mati atau miskin seluruh keluarga mak semua dana 100 bakal jadi ajang korupsi,"sure and between to give the dumplings if the legal corruptors are as tough as the death penalty or poor as the whole family, all the funds of 100 will be the scene of corruption"
1090,sulit pak percaya tempat orang2 pernah jadi sangka korupsi posisi penting yakin mmg penting politik dalam danantara mesti curiga,"it is difficult, sir, to believe that people's places have ever been suspected of corruption, an important position, they are sure that the important political in and between must be suspicious"
1091,mo berita kasus korupsi timah pertamina sekarang asdp apa itu danantara yaudahlah gue mau jalan ramadhan sebaikbaiknya biar ku adu klen satu satu pas shalat,mo news of the Pertamina tin corruption case now asdp what it is and between it is easy for me to want the best Ramadan road so I can fight klen one one pas prayer
1092,where is the outlook banyak banget mega korupsi bumn terus sekarang kes mau hilang trust issue masyarakat keluar statement risi amat good governance cuman angan2 kalau dalem danantara orang punya track record kurang baik,where is the outlook so much mega corruption bumn then now the case of wanting to lose public trust issue out statement risi very good governance only wish if dalem and between people have a bad track record
1093,gak sabar ih ken liat berita korupsi danantara,can't wait to see the news of corruption and between
1094,bagaimana masyarakat percaya danantara kelola pihak afiliasi final occrp yang jelasjelas punya rekam jejak korupsi,how the public believes and how to manage the final occrp affiliates who clearly have a track record of corruption
1095,lo cukup ngurusin korupsi kamu cukup eliminasi pala kamu cukup ngurusi inefisiensi tata kelola sungguh kamu cukup tahan proker jalan udah terima baik masyarakat kamu cukup hadir pasti hukum kamu danantara masalah emang good governance tok,you just take care of corruption you just eliminate nutmeg you just take care of governance inefficiencies really you are quite resistant to road workers already received well your community is quite present definitely your law and between problems good governance tok
1096,dapat pak sby rencana pak prabowo kuat investasi nasional ada danantara pondasi hukum koruptor begitu tegas cuma jadi lahan mega korupsi apa tanggung jawab kalian jika jadi korupsi,can sir sby plan sir prabowo strong national investment there is and among the foundations of corrupt law is so firm just so mega corruption land what is your responsibility if it becomes corruption
1097,terlakamu bnyak sodor bijak rakyat pusing mana benarbenar untung mana benarbenar bikin rugi padahal ngambil langkah tingkat kerja guna bumn malah rilis gudang korupsi baru danantara negara penuh dng orang lucu,overlooked bnyak sodor wise people are dizzy where really profit where really make a loss even though taking work rate steps for bumn even the release of new corrupt warehouses and between countries full of funny people
1098,masyarakat trust issue jabat jabat ada sekarang banyak kasus korupsi baru aja kuak jajar bumn maupun asn bagaimana mungkin masyarakat mau saja percaya danantara benar benar jadi investasi,community trust issue dabat dabat there are now many new corruption cases just kak jajar bumn and asn how can people want to believe and between really be an investment
1099,semua indikiasii tunjuk danantara akan jadi bahan korupsi seperti bumn lain jalan orang yang hoby maling,all indikiasii points out and between will be a material for corruption like any other bumn in the way of people who are hobbies of thieves
1100,yakin danantara di korupsi kalo era sekarang di korupsi mungkin era,sure and between in corruption if the current era is in corruption maybe the era
1101,wajar sih beberpa kasus bumn perintah pejabat2nya korup demikian besar dikuatirkan danantara bagai dana untuk ladang korupsi kuasa kroni kroni,it's fair to say that some cases of bumn orders of corrupt officials are so much feared and are like funds for the field of crony power corruption
1102,ahhh duka bapak slakamu kata good governance seperti kalo ucap kata bapak sangat pasih cuma tdk sepasih laksana danantara direspon negatif situ burhanudin abdullah muliaman hadad orang profesional korupsi paham kan,ahhh grief father slakamu said good governance like if you say the word father very pasih just not as loving as it is and between negative responses there burhanudin abdullah mul... hadad corruption professional people understand right
